[
  {
    "id": "clinton-library-doc-2017-0193-m-concept-strategy",
    "title": "NATO Expansion: Concept and Strategy",
    "date": "1994-09-17",
    "year": 1994,
    "documentType": "Policy paper",
    "sourceClass": "clinton-library-mdr",
    "sourceUrl": "https://clinton.presidentiallibraries.us/items/show/118731",
    "pdfUrl": "https://clinton.presidentiallibraries.us/files/original/3a5e05a367487bd0097cd36c04a644c6.pdf",
    "sourceNote": "Source: Clinton Presidential Records, White House Staff and Office Files, Mandatory Declassification Review 2017-0193-M, Clinton Digital Library, PDF pages 1-4. Secret/Sensitive.",
    "sourceNoteStatus": "Document-level provenance",
    "sourcePages": "1-4",
    "pageCount": 4,
    "pageCountStatus": "known",
    "priority": "P0",
    "priorityReasons": ["nato expansion", "strategy", "partnership for peace", "russia"],
    "topics": ["NATO expansion", "Strategy", "Partnership for Peace", "NATO-Russia", "European security architecture"],
    "people": ["Alexander Vershbow"],
    "countries": ["Russia", "Ukraine", "Poland"],
    "nscSoc": {
      "isNscRecord": true,
      "isSummaryOfConclusions": false,
      "committee": "NSC",
      "queuePriority": "front-of-queue"
    },
    "inclusionStatus": "include-candidate",
    "verificationStatus": "ready-for-page-count",
    "upstream": {
      "workspace": "live-clinton-library-document-extraction",
      "packetIdentifier": "2017-0193-M",
      "packetRecordId": "clinton-library-packet-2017-0193-m"
    },
    "notes": "Promoted from the official 2017-0193-M packet after local page-boundary inspection. Packet control remains for duplicate/accounting review."
  },
  {
    "id": "clinton-library-doc-2017-0193-m-hard-questions",
    "title": "Next Steps on NATO Expansion: Hard Questions",
    "date": "1994-09-21",
    "year": 1994,
    "documentType": "Policy paper",
    "sourceClass": "clinton-library-mdr",
    "sourceUrl": "https://clinton.presidentiallibraries.us/items/show/118731",
    "pdfUrl": "https://clinton.presidentiallibraries.us/files/original/3a5e05a367487bd0097cd36c04a644c6.pdf",
    "sourceNote": "Source: Clinton Presidential Records, White House Staff and Office Files, Mandatory Declassification Review 2017-0193-M, Clinton Digital Library, PDF pages 5-12. Secret/Sensitive.",
    "sourceNoteStatus": "Document-level provenance",
    "sourcePages": "5-12",
    "pageCount": 8,
    "pageCountStatus": "known",
    "priority": "P0",
    "priorityReasons": ["nato expansion", "hard questions", "security guarantee", "alliance consultations"],
    "topics": ["NATO expansion", "Alliance consultations", "Security guarantees", "Russia", "Resources", "Senate ratification"],
    "people": [],
    "countries": ["Russia", "Poland", "Hungary", "Czech Republic", "Baltic states", "Ukraine"],
    "nscSoc": {
      "isNscRecord": true,
      "isSummaryOfConclusions": false,
      "committee": "NSC",
      "queuePriority": "front-of-queue"
    },
    "inclusionStatus": "include-candidate",
    "verificationStatus": "ready-for-page-count",
    "upstream": {
      "workspace": "live-clinton-library-document-extraction",
      "packetIdentifier": "2017-0193-M",
      "packetRecordId": "clinton-library-packet-2017-0193-m"
    },
    "notes": "Promoted from the official 2017-0193-M packet after local page-boundary inspection. Document date uses the September 21, 1994 fax timestamp on packet pages 5-12."
  },
  {
    "id": "clinton-library-doc-2015-0770-m-nato-enlargement-game-plan",
    "title": "C-P-L Item: NATO Enlargement",
    "date": "1996-06-06",
    "year": 1996,
    "documentType": "NSC email with attached policy paper",
    "sourceClass": "clinton-library-mdr",
    "sourceUrl": "https://clinton.presidentiallibraries.us/items/show/57565",
    "pdfUrl": "https://clinton.presidentiallibraries.us/files/original/ae02d8219b6f90d0e5fc7a41f099bdce.pdf",
    "sourceNote": "Source: Clinton Presidential Records, NSC Emails, MsMail-Record (Sept 94-Sept 97), [NATO Enlargement and Lake], Mandatory Declassification Review 2015-0770-M, Clinton Digital Library, PDF pages 2-14. Secret.",
    "sourceNoteStatus": "Document-level provenance",
    "sourcePages": "2-14",
    "pageCount": 13,
    "pageCountStatus": "known",
    "priority": "P0",
    "priorityReasons": ["nato enlargement", "game plan", "nato-russia", "esdi", "nac"],
    "topics": ["NATO enlargement", "NATO-Russia", "ESDI", "NAC Ministerial", "Accession talks", "Central and Eastern Europe", "Congressional strategy"],
    "people": ["Anthony Lake", "Warren Christopher", "William Perry", "Yevgeniy Primakov", "John Schmidt", "Daniel Fried", "Alexander Vershbow"],
    "countries": ["Russia", "Poland", "Czech Republic", "Hungary", "Baltic states", "Romania", "Ukraine", "France", "Germany"],
    "nscSoc": {
      "isNscRecord": true,
      "isSummaryOfConclusions": false,
      "committee": "NSC",
      "queuePriority": "front-of-queue"
    },
    "inclusionStatus": "include-candidate",
    "verificationStatus": "ready-for-page-count",
    "upstream": {
      "workspace": "live-clinton-library-document-extraction",
      "packetIdentifier": "2015-0770-M",
      "packetRecordId": "clinton-library-packet-2015-0770-m"
    },
    "notes": "Promoted from the official 2015-0770-M packet after local page-boundary inspection. Packet page 1 is a withdrawal/redaction sheet; the released document runs on PDF pages 2-14 and includes the attached paper 'NATO Enlargement Game Plan: June 96 to June 97.'"
  },
  {
    "id": "clinton-library-doc-2015-0768-m-now-is-not-the-time",
    "title": "NATO Expansion: Now Is Not the Time",
    "date": "1993-10-08",
    "year": 1993,
    "documentType": "Cable",
    "sourceClass": "clinton-library-mdr",
    "sourceUrl": "https://clinton.presidentiallibraries.us/items/show/118449",
    "pdfUrl": "https://clinton.presidentiallibraries.us/files/original/30a20581e145dde08f2fa55c745c04f2.pdf",
    "sourceNote": "Source: Clinton Presidential Records, NSC Records Management, PC0037 PC Meeting on NATO Summit, October 18, 1993, Mandatory Declassification Review 2015-0768-M, Clinton Digital Library, PDF pages 3-8. Secret.",
    "sourceNoteStatus": "Document-level provenance",
    "sourcePages": "3-8",
    "pageCount": 6,
    "pageCountStatus": "known",
    "priority": "P0",
    "priorityReasons": ["nato expansion", "russia", "yeltsin", "pc meeting"],
    "topics": ["NATO expansion", "Russia", "Yeltsin", "January 1994 NATO Summit", "Partnership for Peace"],
    "people": ["Thomas Pickering", "Boris Yeltsin"],
    "countries": ["Russia", "Poland", "Hungary", "Czech Republic"],
    "nscSoc": {
      "isNscRecord": true,
      "isSummaryOfConclusions": false,
      "committee": "Principals Committee",
      "queuePriority": "front-of-queue"
    },
    "inclusionStatus": "include-candidate",
    "verificationStatus": "ready-for-page-count",
    "upstream": {
      "workspace": "live-clinton-library-document-extraction",
      "packetIdentifier": "2015-0768-M",
      "packetRecordId": "clinton-library-packet-2015-0768-m-rmo-2022"
    },
    "notes": "Promoted from the official 2015-0768-M packet after local page-boundary inspection. The withdrawal sheet places this released cable in the October 18, 1993 NATO Summit Principals Committee folder."
  },
  {
    "id": "clinton-library-doc-2015-0768-m-two-january-summits",
    "title": "Russia, NATO and the Two January Summits",
    "date": "1993-09-29",
    "year": 1993,
    "documentType": "Cable",
    "sourceClass": "clinton-library-mdr",
    "sourceUrl": "https://clinton.presidentiallibraries.us/items/show/118449",
    "pdfUrl": "https://clinton.presidentiallibraries.us/files/original/30a20581e145dde08f2fa55c745c04f2.pdf",
    "sourceNote": "Source: Clinton Presidential Records, NSC Records Management, PC0037 PC Meeting on NATO Summit, October 18, 1993, Mandatory Declassification Review 2015-0768-M, Clinton Digital Library, PDF pages 9-15. Secret.",
    "sourceNoteStatus": "Document-level provenance",
    "sourcePages": "9-15",
    "pageCount": 7,
    "pageCountStatus": "known",
    "priority": "P0",
    "priorityReasons": ["nato expansion", "russia", "summit planning", "partnership for peace"],
    "topics": ["NATO expansion", "Russia", "January 1994 NATO Summit", "Moscow summit", "Partnership for Peace", "NACC"],
    "people": ["Thomas Pickering", "Boris Yeltsin", "Warren Christopher"],
    "countries": ["Russia", "Poland", "Hungary", "Czech Republic"],
    "nscSoc": {
      "isNscRecord": true,
      "isSummaryOfConclusions": false,
      "committee": "Principals Committee",
      "queuePriority": "front-of-queue"
    },
    "inclusionStatus": "include-candidate",
    "verificationStatus": "ready-for-page-count",
    "upstream": {
      "workspace": "live-clinton-library-document-extraction",
      "packetIdentifier": "2015-0768-M",
      "packetRecordId": "clinton-library-packet-2015-0768-m-rmo-2022"
    },
    "notes": "Promoted from the official 2015-0768-M packet after local page-boundary inspection. The withdrawal sheet places this released cable in the October 18, 1993 NATO Summit Principals Committee folder."
  },
  {
    "id": "clinton-library-doc-2015-0768-m-yeltsin-nato-expansion",
    "title": "Yeltsin: NATO Expansion",
    "date": "1993-09-20",
    "year": 1993,
    "documentType": "Cable",
    "sourceClass": "clinton-library-mdr",
    "sourceUrl": "https://clinton.presidentiallibraries.us/items/show/118449",
    "pdfUrl": "https://clinton.presidentiallibraries.us/files/original/30a20581e145dde08f2fa55c745c04f2.pdf",
    "sourceNote": "Source: Clinton Presidential Records, NSC Records Management, PC0037 PC Meeting on NATO Summit, October 18, 1993, Mandatory Declassification Review 2015-0768-M, Clinton Digital Library, PDF pages 16-18. Secret.",
    "sourceNoteStatus": "Document-level provenance",
    "sourcePages": "16-18",
    "pageCount": 3,
    "pageCountStatus": "known",
    "priority": "P0",